.hashes/SuggestedActions_hashes.json

{
  "metadata": {
    "last_updated": "2026-10-09T07:39:18.544691",
    "total_pages": 18,
    "session_id": "2026-10-09T07:39:16.973931"
  },
  "hashes": {
    "https://developer.apple.com/tutorials/data/documentation/SuggestedActions.json": {
      "hash": "f82ee2602cb9f1a08e1db6ad8d0467307582b0db1c6742b72435f99f9762f07d",
      "last_checked": "2026-10-09T07:39:17.267138",
      "status": "unchanged",
      "session_id": "2026-10-09T07:39:16.973931",
      "etag": "\"174e-65b3b5213f6fb-df\"",
      "file_path": "documentation/SuggestedActions/SuggestedActions.md"
    },
    "https://developer.apple.com/documentation/SuggestedActions": {
      "hash": "f82ee2602cb9f1a08e1db6ad8d0467307582b0db1c6742b72435f99f9762f07d",
      "last_checked": "2026-10-09T07:39:17.164457",
      "status": "unchanged",
      "session_id": "2026-10-09T07:39:16.973931",
      "etag": "\"174e-65b3b5213f6fb-df\"",
      "file_path": "documentation/SuggestedActions/SuggestedActions.md"
    },
    "https://developer.apple.com/tutorials/data/documentation/suggestedactions/suggestedactionsview.json": {
      "hash": "fd8f46540c53b0b4f107e7761fd2a80e80d0b3d192106040adf1aad44183c8a2",
      "last_checked": "2026-10-09T07:39:17.483188",
      "status": "unchanged",
      "session_id": "2026-10-09T07:39:16.973931",
      "etag": "\"48c2-65b3b5213f6fb-df\"",
      "file_path": "documentation/SuggestedActions/suggestedactionsview.md"
    },
    "https://developer.apple.com/documentation/suggestedactions/suggestedactionsview": {
      "hash": "fd8f46540c53b0b4f107e7761fd2a80e80d0b3d192106040adf1aad44183c8a2",
      "last_checked": "2026-09-15T07:29:29.785864",
      "status": "unchanged",
      "session_id": "2026-09-15T07:29:29.064389",
      "etag": "\"48c2-65b3b5213f6fb-df\"",
      "file_path": "documentation/SuggestedActions/suggestedactionsview.md"
    },
    "https://developer.apple.com/tutorials/data/documentation/suggestedactions/suggestedactionsview/init(message:previousmessages:).json": {
      "hash": "221f524e7327ad1598c2720c5148d76758484d7d57b32b8ba8044b2267389969",
      "last_checked": "2026-10-09T07:39:17.645683",
      "status": "unchanged",
      "session_id": "2026-10-09T07:39:16.973931",
      "etag": "\"3373-65b3b5213f6fb-df\"",
      "file_path": "documentation/SuggestedActions/suggestedactionsview/init-messagepreviousmessages.md"
    },
    "https://developer.apple.com/documentation/suggestedactions/suggestedactionsview/init(message:previousmessages:)": {
      "hash": "221f524e7327ad1598c2720c5148d76758484d7d57b32b8ba8044b2267389969",
      "last_checked": "2026-09-15T07:29:29.881449",
      "status": "unchanged",
      "session_id": "2026-09-15T07:29:29.064389",
      "etag": "\"3373-65b3b5213f6fb-df\"",
      "file_path": "documentation/SuggestedActions/suggestedactionsview/init-messagepreviousmessages.md"
    },
    "https://developer.apple.com/tutorials/data/documentation/suggestedactions/suggestedactionsview/generate(message:previousmessages:).json": {
      "hash": "3cbfaec11d64654a568ef1d776f464b086fc3792af71b43c73b9a77fa821b587",
      "last_checked": "2026-10-09T07:39:17.761016",
      "status": "unchanged",
      "session_id": "2026-10-09T07:39:16.973931",
      "etag": "\"32bb-65b3b5213f6fb-df\"",
      "file_path": "documentation/SuggestedActions/suggestedactionsview/generate-messagepreviousmessages.md"
    },
    "https://developer.apple.com/documentation/suggestedactions/suggestedactionsview/generate(message:previousmessages:)": {
      "hash": "3cbfaec11d64654a568ef1d776f464b086fc3792af71b43c73b9a77fa821b587",
      "last_checked": "2026-09-15T07:29:30.185663",
      "status": "unchanged",
      "session_id": "2026-09-15T07:29:29.064389",
      "etag": "\"32bb-65b3b5213f6fb-df\"",
      "file_path": "documentation/SuggestedActions/suggestedactionsview/generate-messagepreviousmessages.md"
    },
    "https://developer.apple.com/tutorials/data/documentation/suggestedactions/suggestedactionsmessage.json": {
      "hash": "abe8a928dc7ccd89230452a27b7e5654d644b2d059f1b0fe0b5a6afa98be7ba7",
      "last_checked": "2026-10-09T07:39:17.905198",
      "status": "unchanged",
      "session_id": "2026-10-09T07:39:16.973931",
      "etag": "\"38ca-65b3b5213f6fb-df\"",
      "file_path": "documentation/SuggestedActions/suggestedactionsmessage.md"
    },
    "https://developer.apple.com/documentation/suggestedactions/suggestedactionsmessage": {
      "hash": "abe8a928dc7ccd89230452a27b7e5654d644b2d059f1b0fe0b5a6afa98be7ba7",
      "last_checked": "2026-09-15T07:29:30.288532",
      "status": "unchanged",
      "session_id": "2026-09-15T07:29:29.064389",
      "etag": "\"38ca-65b3b5213f6fb-df\"",
      "file_path": "documentation/SuggestedActions/suggestedactionsmessage.md"
    },
    "https://developer.apple.com/tutorials/data/documentation/suggestedactions/suggestedactionsmessage/init(id:date:subject:body:sender:recipients:).json": {
      "hash": "c1bf4313481a881968d1ca1988ed709a221baeb06568e6b9ec4251ccaffd8850",
      "last_checked": "2026-10-09T07:39:18.032786",
      "status": "unchanged",
      "session_id": "2026-10-09T07:39:16.973931",
      "etag": "\"3600-65b3b5213f6fb-df\"",
      "file_path": "documentation/SuggestedActions/suggestedactionsmessage/init-iddatesubjectbodysenderrecipients.md"
    },
    "https://developer.apple.com/documentation/suggestedactions/suggestedactionsmessage/init(id:date:subject:body:sender:recipients:)": {
      "hash": "c1bf4313481a881968d1ca1988ed709a221baeb06568e6b9ec4251ccaffd8850",
      "last_checked": "2026-09-15T07:29:30.402694",
      "status": "unchanged",
      "session_id": "2026-09-15T07:29:29.064389",
      "etag": "\"3600-65b3b5213f6fb-df\"",
      "file_path": "documentation/SuggestedActions/suggestedactionsmessage/init-iddatesubjectbodysenderrecipients.md"
    },
    "https://developer.apple.com/tutorials/data/documentation/suggestedactions/suggestedactionsmessage/participant.json": {
      "hash": "042dac98ac6573c4ad2af985aafeccadcdf6efc4ced372a6d450f0f6ded2c202",
      "last_checked": "2026-10-09T07:39:18.253427",
      "status": "unchanged",
      "session_id": "2026-10-09T07:39:16.973931",
      "etag": "\"3002-65b3b5213f6fb-df\"",
      "file_path": "documentation/SuggestedActions/suggestedactionsmessage/participant.md"
    },
    "https://developer.apple.com/documentation/suggestedactions/suggestedactionsmessage/participant": {
      "hash": "042dac98ac6573c4ad2af985aafeccadcdf6efc4ced372a6d450f0f6ded2c202",
      "last_checked": "2026-09-15T07:29:30.447054",
      "status": "unchanged",
      "session_id": "2026-09-15T07:29:29.064389",
      "etag": "\"3002-65b3b5213f6fb-df\"",
      "file_path": "documentation/SuggestedActions/suggestedactionsmessage/participant.md"
    },
    "https://developer.apple.com/tutorials/data/documentation/suggestedactions/suggestedactionsmessage/previousmessageslimit.json": {
      "hash": "dff1cc3f93c6d3bd37e7b5412e2cf938b0b99ee26590012bff223c4e2dc2902f",
      "last_checked": "2026-10-09T07:39:18.380323",
      "status": "unchanged",
      "session_id": "2026-10-09T07:39:16.973931",
      "etag": "\"26dd-65b3b5213f6fb-df\"",
      "file_path": "documentation/SuggestedActions/suggestedactionsmessage/previousmessageslimit.md"
    },
    "https://developer.apple.com/documentation/suggestedactions/suggestedactionsmessage/previousmessageslimit": {
      "hash": "dff1cc3f93c6d3bd37e7b5412e2cf938b0b99ee26590012bff223c4e2dc2902f",
      "last_checked": "2026-09-15T07:29:30.575880",
      "status": "unchanged",
      "session_id": "2026-09-15T07:29:29.064389",
      "etag": "\"26dd-65b3b5213f6fb-df\"",
      "file_path": "documentation/SuggestedActions/suggestedactionsmessage/previousmessageslimit.md"
    },
    "https://developer.apple.com/tutorials/data/documentation/suggestedactions/suggestedactionsmessage/participant/init(name:handle:isuser:).json": {
      "hash": "392b27caef020dafecad7932b47762b28b4374037cfe28a923f20370c17aea60",
      "last_checked": "2026-10-09T07:39:18.502026",
      "status": "unchanged",
      "session_id": "2026-10-09T07:39:16.973931",
      "etag": "\"227a-65b3b5213f6fb-df\"",
      "file_path": "documentation/SuggestedActions/suggestedactionsmessage/participant/init-namehandleisuser.md"
    },
    "https://developer.apple.com/documentation/suggestedactions/suggestedactionsmessage/participant/init(name:handle:isuser:)": {
      "hash": "392b27caef020dafecad7932b47762b28b4374037cfe28a923f20370c17aea60",
      "last_checked": "2026-09-15T07:29:30.636873",
      "status": "unchanged",
      "session_id": "2026-09-15T07:29:29.064389",
      "etag": "\"227a-65b3b5213f6fb-df\"",
      "file_path": "documentation/SuggestedActions/suggestedactionsmessage/participant/init-namehandleisuser.md"
    }
  }
}

documentation/ios-ipados-release-notes/ios-ipados-17-1-release-notes.md

###### Resolved Issues

- Fixed: Increased power consumption might occur when an Apple watch running watchOS10.1 is paired with an iPhone with iOS 17.0 (or watchOS10.0 is paired with iOS17.1).   (116348186)

## See Also

- [iOS & iPadOS 17.6 Release Notes](ios-ipados-17_6-release-notes.md)
  Update your apps to use new features, and test your apps against API changes.
- [iOS & iPadOS 17.5 Release Notes](ios-ipados-17_5-release-notes.md)
  Update your apps to use new features, and test your apps against API changes.
- [iOS & iPadOS 17.4 Release Notes](ios-ipados-17_4-release-notes.md)
  Update your apps to use new features, and test your apps against API changes.
- [iOS & iPadOS 17.3 Release Notes](ios-ipados-17_3-release-notes.md)
  Update your apps to use new features, and test your apps against API changes.
- [iOS & iPadOS 17.2 Release Notes](ios-ipados-17_2-release-notes.md)
  Update your apps to use new features, and test your apps against API changes.
- [iOS & iPadOS 17 Release Notes](ios-ipados-17-release-notes.md)
  Update your apps to use new features, and test your apps against API changes.